{
  "schemaVersion": 1,
  "generatedAt": "2026-10-11T20:41:03.0000000+00:00",
  "sourceRevision": "9a4c3b268d62c1c148ec776679bd94a9fedf5c7e",
  "entries": [
    {
      "id": "hkmod:AbsRad Configurable Attacks",
      "addedAt": "2023-09-21T15:39:11.0000000+00:00",
      "updatedAt": "2023-11-13T08:16:34.0000000+00:00"
    },
    {
      "id": "hkmod:AbsRad Teleport Control",
      "addedAt": "2023-09-21T15:39:11.0000000+00:00",
      "updatedAt": "2023-11-13T08:16:34.0000000+00:00"
    },
    {
      "id": "hkmod:Abskoth",
      "addedAt": "2022-02-22T04:57:23.0000000+00:00",
      "updatedAt": "2022-09-15T05:41:06.0000000+00:00"
    },
    {
      "id": "hkmod:AbsoluteZote",
      "addedAt": "2022-06-20T09:04:06.0000000+00:00",
      "updatedAt": "2025-08-26T08:25:41.0000000+00:00"
    },
    {
      "id": "hkmod:AccessRandomizer",
      "addedAt": "2024-05-03T15:28:18.0000000+00:00",
      "updatedAt": "2026-08-06T15:11:31.0000000+00:00"
    },
    {
      "id": "hkmod:AdBlocker",
      "addedAt": "2024-09-27T07:15:24.0000000+00:00",
      "updatedAt": "2025-02-28T16:03:30.0000000+00:00"
    },
    {
      "id": "hkmod:Additional Challenge",
      "addedAt": "2022-06-03T18:49:50.0000000+00:00",
      "updatedAt": "2022-11-17T22:22:09.0000000+00:00"
    },
    {
      "id": "hkmod:Additional Timelines",
      "addedAt": "2022-09-26T18:15:56.0000000+00:00",
      "updatedAt": "2023-07-19T01:51:16.0000000+00:00"
    },
    {
      "id": "hkmod:AdditionalMaps",
      "addedAt": "2021-08-22T15:25:58.0000000+00:00",
      "updatedAt": "2025-09-18T16:21:19.0000000+00:00"
    },
    {
      "id": "hkmod:Ado Death Scream",
      "addedAt": "2026-04-06T11:21:02.0000000+00:00",
      "updatedAt": "2026-05-01T19:08:12.0000000+00:00"
    },
    {
      "id": "hkmod:Afterimage Plus",
      "addedAt": "2024-06-15T23:26:24.0000000+00:00",
      "updatedAt": "2025-08-26T08:25:41.0000000+00:00"
    },
    {
      "id": "hkmod:All4Love",
      "addedAt": "2025-06-14T19:29:32.0000000+00:00",
      "updatedAt": "2025-06-14T19:29:32.0000000+00:00"
    },
    {
      "id": "hkmod:AllGrubRewardsAtOnce",
      "addedAt": "2025-11-21T16:26:42.0000000+00:00",
      "updatedAt": "2026-04-20T20:31:19.0000000+00:00"
    },
    {
      "id": "hkmod:AllHallownestEnhanced",
      "addedAt": "2025-01-06T16:40:45.0000000+00:00",
      "updatedAt": "2025-01-06T16:40:45.0000000+00:00"
    },
    {
      "id": "hkmod:AlphabetRando",
      "addedAt": "2026-02-13T08:42:21.0000000+00:00",
      "updatedAt": "2026-08-06T06:05:09.0000000+00:00"
    },
    {
      "id": "hkmod:AlreadyEnoughPlayMaker",
      "addedAt": "2023-03-30T05:39:59.0000000+00:00",
      "updatedAt": "2023-03-30T05:39:59.0000000+00:00"
    },
    {
      "id": "hkmod:Always Furious",
      "addedAt": "2022-12-01T22:30:54.0000000+00:00",
      "updatedAt": "2022-12-01T22:30:54.0000000+00:00"
    },
    {
      "id": "hkmod:AlwaysHazardRespawn",
      "addedAt": "2025-09-23T04:28:34.0000000+00:00",
      "updatedAt": "2026-09-06T20:56:24.0000000+00:00"
    },
    {
      "id": "hkmod:AlwaysWorldSense",
      "addedAt": "2024-10-31T17:28:51.0000000+00:00",
      "updatedAt": "2026-09-06T20:56:24.0000000+00:00"
    },
    {
      "id": "hkmod:Ancient Aspid",
      "addedAt": "2024-04-12T18:50:54.0000000+00:00",
      "updatedAt": "2024-05-25T19:13:04.0000000+00:00"
    },
    {
      "id": "hkmod:Another Location",
      "addedAt": "2026-07-16T17:38:47.0000000+00:00",
      "updatedAt": "2026-09-26T06:04:40.0000000+00:00"
    },
    {
      "id": "hkmod:Any Radiance 3.0",
      "addedAt": "2023-04-19T10:04:24.0000000+00:00",
      "updatedAt": "2023-04-19T10:04:24.0000000+00:00"
    },
    {
      "id": "hkmod:AnyZote",
      "addedAt": "2024-03-28T04:44:34.0000000+00:00",
      "updatedAt": "2025-01-28T16:19:35.0000000+00:00"
    },
    {
      "id": "hkmod:Arcade Knight",
      "addedAt": "2024-10-30T22:55:21.0000000+00:00",
      "updatedAt": "2024-11-03T17:45:33.0000000+00:00"
    },
    {
      "id": "hkmod:Archipelago",
      "addedAt": "2022-04-03T19:04:35.0000000+00:00",
      "updatedAt": "2026-04-20T02:29:14.0000000+00:00"
    },
    {
      "id": "hkmod:Archipelago Map Mod",
      "addedAt": "2022-06-23T10:38:15.0000000+00:00",
      "updatedAt": "2026-04-20T02:29:14.0000000+00:00"
    },
    {
      "id": "hkmod:Architect",
      "addedAt": "2025-06-17T15:45:52.0000000+00:00",
      "updatedAt": "2026-10-11T20:22:59.0000000+00:00"
    },
    {
      "id": "hkmod:ArchitectLegacy",
      "addedAt": "2026-05-20T17:32:19.0000000+00:00",
      "updatedAt": "2026-08-30T09:58:43.0000000+00:00"
    },
    {
      "id": "hkmod:Archiv",
      "addedAt": "2024-11-09T09:40:39.0000000+00:00",
      "updatedAt": "2026-09-06T20:56:24.0000000+00:00"
    },
    {
      "id": "hkmod:AsciiCamera",
      "addedAt": "2021-09-08T06:14:21.0000000+00:00",
      "updatedAt": "2022-07-07T11:25:37.0000000+00:00"
    },
    {
      "id": "hkmod:Aspid Queen",
      "addedAt": "2022-07-05T13:41:03.0000000+00:00",
      "updatedAt": "2023-04-11T06:37:42.0000000+00:00"
    },
    {
      "id": "hkmod:Aspidnest",
      "addedAt": "2022-03-29T20:23:53.0000000+00:00",
      "updatedAt": "2022-05-09T18:24:51.0000000+00:00"
    },
    {
      "id": "hkmod:AspyCompanion",
      "addedAt": "2023-02-19T00:56:24.0000000+00:00",
      "updatedAt": "2023-02-19T00:56:24.0000000+00:00"
    },
    {
      "id": "hkmod:Asymmetric Knight",
      "addedAt": "2022-02-06T11:19:46.0000000+00:00",
      "updatedAt": "2022-05-09T18:24:51.0000000+00:00"
    },
    {
      "id": "hkmod:AuraRad",
      "addedAt": "2026-03-19T16:28:58.0000000+00:00",
      "updatedAt": "2026-03-19T16:28:58.0000000+00:00"
    },
    {
      "id": "hkmod:Backdash",
      "addedAt": "2022-12-26T05:29:51.0000000+00:00",
      "updatedAt": "2024-05-08T21:37:09.0000000+00:00"
    },
    {
      "id": "hkmod:BaldurRngConfig",
      "addedAt": "2025-07-31T15:15:07.0000000+00:00",
      "updatedAt": "2025-07-31T15:15:07.0000000+00:00"
    },
    {
      "id": "hkmod:BenchDeploy",
      "addedAt": "2024-05-15T09:39:52.0000000+00:00",
      "updatedAt": "2024-09-08T10:21:42.0000000+00:00"
    },
    {
      "id": "hkmod:BenchRando",
      "addedAt": "2022-06-19T18:49:23.0000000+00:00",
      "updatedAt": "2026-01-11T23:21:03.0000000+00:00"
    },
    {
      "id": "hkmod:BenchWarpFix",
      "addedAt": "2021-08-22T15:25:58.0000000+00:00",
      "updatedAt": "2025-05-01T15:21:07.0000000+00:00"
    },
    {
      "id": "hkmod:Benchwarp",
      "addedAt": "2021-08-15T23:38:26.0000000+00:00",
      "updatedAt": "2026-01-11T23:21:03.0000000+00:00"
    },
    {
      "id": "hkmod:BenchwarpSpoilerCloak",
      "addedAt": "2022-07-07T03:52:29.0000000+00:00",
      "updatedAt": "2022-07-07T03:52:29.0000000+00:00"
    },
    {
      "id": "hkmod:Better Godhome Music",
      "addedAt": "2023-04-19T09:01:30.0000000+00:00",
      "updatedAt": "2023-05-01T09:16:14.0000000+00:00"
    },
    {
      "id": "hkmod:Better Void Heart",
      "addedAt": "2022-06-29T17:48:12.0000000+00:00",
      "updatedAt": "2022-07-29T22:50:25.0000000+00:00"
    },
    {
      "id": "hkmod:BetterCrystalHeart",
      "addedAt": "2025-11-02T05:52:34.0000000+00:00",
      "updatedAt": "2026-02-23T06:23:30.0000000+00:00"
    },
    {
      "id": "hkmod:BetterModList",
      "addedAt": "2024-12-06T16:04:13.0000000+00:00",
      "updatedAt": "2024-12-06T16:04:13.0000000+00:00"
    },
    {
      "id": "hkmod:BetterParrying",
      "addedAt": "2026-09-27T11:49:34.0000000+00:00",
      "updatedAt": "2026-09-27T11:49:34.0000000+00:00"
    },
    {
      "id": "hkmod:BetterScreenShot",
      "addedAt": "2026-10-09T02:03:59.0000000+00:00",
      "updatedAt": "2026-10-09T02:03:59.0000000+00:00"
    },
    {
      "id": "hkmod:Biblically Accurate Lasers",
      "addedAt": "2024-07-02T20:24:50.0000000+00:00",
      "updatedAt": "2024-07-03T17:33:24.0000000+00:00"
    },
    {
      "id": "hkmod:BingoAdvancedCustomGeneration",
      "addedAt": "2026-03-16T01:13:36.0000000+00:00",
      "updatedAt": "2026-04-23T21:36:39.0000000+00:00"
    },
    {
      "id": "hkmod:BingoBoard",
      "addedAt": "2022-01-25T07:38:47.0000000+00:00",
      "updatedAt": "2022-05-24T20:25:14.0000000+00:00"
    },
    {
      "id": "hkmod:BingoBoardReplay",
      "addedAt": "2025-05-07T15:30:13.0000000+00:00",
      "updatedAt": "2026-04-23T03:53:57.0000000+00:00"
    },
    {
      "id": "hkmod:BingoGoalPack1",
      "addedAt": "2024-04-20T10:13:30.0000000+00:00",
      "updatedAt": "2026-03-16T01:13:36.0000000+00:00"
    },
    {
      "id": "hkmod:BingoGoalPack2",
      "addedAt": "2024-10-30T09:34:57.0000000+00:00",
      "updatedAt": "2026-03-16T01:13:36.0000000+00:00"
    },
    {
      "id": "hkmod:BingoGoalPackGrubDay",
      "addedAt": "2026-06-12T21:23:02.0000000+00:00",
      "updatedAt": "2026-06-12T21:23:02.0000000+00:00"
    },
    {
      "id": "hkmod:BingoGoalPackSpleengy",
      "addedAt": "2026-04-24T08:08:25.0000000+00:00",
      "updatedAt": "2026-04-24T08:08:25.0000000+00:00"
    },
    {
      "id": "hkmod:BingoSync",
      "addedAt": "2023-06-09T13:45:54.0000000+00:00",
      "updatedAt": "2026-04-23T03:53:57.0000000+00:00"
    },
    {
      "id": "hkmod:BingoSyncExtension",
      "addedAt": "2024-04-20T10:13:30.0000000+00:00",
      "updatedAt": "2024-09-02T15:46:55.0000000+00:00"
    },
    {
      "id": "hkmod:BingoUI",
      "addedAt": "2021-11-12T11:58:10.0000000+00:00",
      "updatedAt": "2025-07-19T09:11:43.0000000+00:00"
    },
    {
      "id": "hkmod:BlindRadiance",
      "addedAt": "2021-08-22T15:25:58.0000000+00:00",
      "updatedAt": "2025-08-28T16:28:13.0000000+00:00"
    },
    {
      "id": "hkmod:BlueSR_OST",
      "addedAt": "2026-04-09T15:23:01.0000000+00:00",
      "updatedAt": "2026-04-17T20:44:46.0000000+00:00"
    },
    {
      "id": "hkmod:Bomber Knight",
      "addedAt": "2023-03-02T21:35:23.0000000+00:00",
      "updatedAt": "2024-05-16T15:05:40.0000000+00:00"
    },
    {